{
  "$schema": "https://json-schema.org/draft/2020-12/schema",
  "$id": "https://github.com/menaje/codex-mcp-bridge-for-chatgpt/raw/main/release-manifest.schema.json",
  "title": "Codex MCP Bridge for ChatGPT release manifest",
  "type": "object",
  "additionalProperties": false,
  "required": ["$schema", "manifestVersion", "product", "package", "toolchain", "repository", "plugin", "uiResources", "stateCompatibility", "release"],
  "properties": {
    "$schema": {
      "const": "./release-manifest.schema.json"
    },
    "manifestVersion": {
      "const": 6
    },
    "product": {
      "type": "object",
      "additionalProperties": false,
      "required": ["displayName", "description", "runtimeName"],
      "properties": {
        "displayName": { "type": "string", "minLength": 1, "maxLength": 100 },
        "description": { "type": "string", "minLength": 1, "maxLength": 240 },
        "runtimeName": { "type": "string", "pattern": "^[a-z0-9][a-z0-9._-]*$", "maxLength": 100 }
      }
    },
    "package": {
      "type": "object",
      "additionalProperties": false,
      "required": ["name", "binaryName", "license", "files", "keywords"],
      "properties": {
        "name": { "type": "string", "pattern": "^[a-z0-9][a-z0-9._-]*$", "maxLength": 214 },
        "binaryName": { "type": "string", "pattern": "^[a-z0-9][a-z0-9._-]*$", "maxLength": 100 },
        "license": { "type": "string", "minLength": 1, "maxLength": 50 },
        "files": {
          "type": "array",
          "minItems": 1,
          "maxItems": 30,
          "uniqueItems": true,
          "items": {
            "type": "string",
            "pattern": "^[A-Za-z0-9._-]+(?:/[A-Za-z0-9._-]+)*$",
            "maxLength": 160,
            "not": { "pattern": "(^|/)\\.\\.?($|/)" }
          }
        },
        "keywords": {
          "type": "array",
          "minItems": 1,
          "maxItems": 20,
          "uniqueItems": true,
          "items": { "type": "string", "pattern": "^[a-z0-9][a-z0-9._-]*$", "maxLength": 50 }
        }
      }
    },
    "toolchain": {
      "type": "object",
      "additionalProperties": false,
      "required": ["node", "npm", "codexCli"],
      "properties": {
        "node": { "type": "string", "pattern": "^(?:[2-9][0-9]*)$" },
        "npm": { "type": "string", "pattern": "^(0|[1-9][0-9]*)\\.(0|[1-9][0-9]*)\\.(0|[1-9][0-9]*)$" },
        "codexCli": { "type": "string", "pattern": "^(0|[1-9][0-9]*)\\.(0|[1-9][0-9]*)\\.(0|[1-9][0-9]*)(?:-[0-9A-Za-z.-]+)?(?:\\+[0-9A-Za-z.-]+)?$" }
      }
    },
    "repository": {
      "type": "object",
      "additionalProperties": false,
      "required": ["provider", "owner", "name"],
      "properties": {
        "provider": { "const": "github" },
        "owner": { "type": "string", "pattern": "^[A-Za-z0-9](?:[A-Za-z0-9-]{0,37}[A-Za-z0-9])?$" },
        "name": { "type": "string", "pattern": "^[A-Za-z0-9._-]+$", "maxLength": 100 }
      }
    },
    "plugin": {
      "type": "object",
      "additionalProperties": false,
      "required": [
        "name",
        "displayName",
        "shortDescription",
        "longDescription",
        "developerName",
        "category",
        "capabilities",
        "defaultPrompt",
        "app"
      ],
      "properties": {
        "name": {
          "type": "string",
          "pattern": "^[a-z0-9]+(?:-[a-z0-9]+)*$",
          "maxLength": 64
        },
        "displayName": { "type": "string", "minLength": 1, "maxLength": 80 },
        "shortDescription": { "type": "string", "minLength": 1, "maxLength": 80 },
        "longDescription": { "type": "string", "minLength": 1, "maxLength": 500 },
        "developerName": { "type": "string", "minLength": 1, "maxLength": 80 },
        "category": { "type": "string", "minLength": 1, "maxLength": 80 },
        "capabilities": {
          "type": "array",
          "minItems": 1,
          "maxItems": 12,
          "uniqueItems": true,
          "items": { "type": "string", "minLength": 1, "maxLength": 100 }
        },
        "defaultPrompt": {
          "type": "array",
          "minItems": 1,
          "maxItems": 3,
          "uniqueItems": true,
          "items": { "type": "string", "minLength": 1, "maxLength": 128 }
        },
        "app": {
          "type": "object",
          "additionalProperties": false,
          "required": ["name", "id"],
          "properties": {
            "name": {
              "type": "string",
              "pattern": "^[a-z0-9]+(?:-[a-z0-9]+)*$",
              "maxLength": 64
            },
            "id": {
              "type": "string",
              "pattern": "^plugin_asdk_app_[A-Za-z0-9]+$",
              "maxLength": 128
            }
          }
        }
      }
    },
    "uiResources": {
      "type": "object",
      "additionalProperties": false,
      "required": [
        "strategy",
        "hashAlgorithm",
        "minimumContractGeneration",
        "resources",
        "activeResources",
        "compatibilityResources",
        "releaseCatalog",
        "releaseCatalogSha256"
      ],
      "properties": {
        "strategy": { "const": "versioned-uri" },
        "hashAlgorithm": { "const": "sha256" },
        "minimumContractGeneration": {
          "type": "object",
          "additionalProperties": false,
          "required": ["settings", "dashboard"],
          "properties": {
            "settings": { "type": "integer", "minimum": 1 },
            "dashboard": { "type": "integer", "minimum": 1 }
          }
        },
        "resources": {
          "type": "array",
          "minItems": 2,
          "maxItems": 2,
          "uniqueItems": true,
          "items": { "enum": ["settings", "dashboard"] },
          "allOf": [
            { "contains": { "const": "settings" } },
            { "contains": { "const": "dashboard" } }
          ]
        },
        "activeResources": {
          "type": "array",
          "minItems": 2,
          "maxItems": 2,
          "prefixItems": [
            { "const": "settings" },
            { "const": "dashboard" }
          ],
          "items": false
        },
        "compatibilityResources": {
          "type": "array",
          "maxItems": 0,
          "items": false
        },
        "releaseCatalog": { "const": "ui-release-catalog.json" },
        "releaseCatalogSha256": { "type": "string", "pattern": "^[0-9a-f]{64}$" }
      }
    },
    "stateCompatibility": {
      "type": "object",
      "additionalProperties": false,
      "required": [
        "currentSchema",
        "supportedSourceSchemas",
        "unsupportedSourceSchemas",
        "retiredLegacyImports",
        "migrationCatalog",
        "migrationCatalogSha256",
        "stateProfilePolicy",
        "rollbackPolicy",
        "persistentContracts",
        "contractSources",
        "recoveryContract"
      ],
      "properties": {
        "currentSchema": { "const": 31 },
        "supportedSourceSchemas": {
          "type": "array",
          "minItems": 28,
          "maxItems": 28,
          "uniqueItems": true,
          "prefixItems": [
            { "const": 3 }, { "const": 4 }, { "const": 5 }, { "const": 6 },
            { "const": 7 }, { "const": 8 }, { "const": 9 }, { "const": 10 },
            { "const": 11 }, { "const": 12 }, { "const": 13 }, { "const": 14 },
            { "const": 15 }, { "const": 16 }, { "const": 17 }, { "const": 18 },
            { "const": 19 }, { "const": 20 }, { "const": 21 },
            { "const": 22 }, { "const": 23 }, { "const": 24 },
            { "const": 25 }, { "const": 26 }, { "const": 27 },
            { "const": 28 }, { "const": 29 }, { "const": 30 }
          ],
          "items": false
        },
        "unsupportedSourceSchemas": {
          "type": "array",
          "prefixItems": [{ "const": 1 }, { "const": 2 }],
          "minItems": 2,
          "maxItems": 2,
          "items": false
        },
        "retiredLegacyImports": {
          "type": "array",
          "prefixItems": [
            { "const": "settings-state-json" },
            { "const": "session-state-json" },
            { "const": "job-state-json" }
          ],
          "minItems": 3,
          "maxItems": 3,
          "items": false
        },
        "migrationCatalog": { "const": "state-migrations.json" },
        "migrationCatalogSha256": { "type": "string", "pattern": "^[0-9a-f]{64}$" },
        "stateProfilePolicy": { "const": "release-stage-isolated-v1" },
        "rollbackPolicy": { "const": "verified-original-before-service-open-v1" },
        "persistentContracts": {
          "type": "object",
          "additionalProperties": false,
          "required": [
            "userSettingsSchema",
            "taskInputContract",
            "macosHelperProtocol",
            "localCompanionProtocol",
            "remoteCompanionProtocol"
          ],
          "properties": {
            "userSettingsSchema": { "const": 7 },
            "taskInputContract": { "const": 6 },
            "macosHelperProtocol": { "const": 2 },
            "localCompanionProtocol": { "const": 12 },
            "remoteCompanionProtocol": { "const": 10 }
          }
        },
        "contractSources": {
          "type": "object",
          "additionalProperties": false,
          "required": [
            "databaseSchema", "userSettings", "taskInput", "macosHelper",
            "localCompanion", "remoteCompanion", "uiResources", "executionBackend"
          ],
          "properties": {
            "databaseSchema": { "const": "src/stateSchema.ts#CURRENT_STATE_SCHEMA_VERSION" },
            "userSettings": { "const": "src/modelPolicy.ts#MODEL_POLICY_SCHEMA_VERSION" },
            "taskInput": { "const": "src/tools.ts#CODEX_TASK_INPUT_CONTRACT_VERSION" },
            "macosHelper": { "const": "src/macosHelperServer.ts#MACOS_HELPER_PROTOCOL_VERSION" },
            "localCompanion": { "const": "src/companionServer.ts#COMPANION_PROTOCOL_VERSION" },
            "remoteCompanion": { "const": "src/remoteCompanionServer.ts#REMOTE_COMPANION_PROTOCOL_VERSION" },
            "uiResources": { "const": "uiResources.minimumContractGeneration" },
            "executionBackend": { "const": "toolchain.codexCli+app-server-schema.lock.json" }
          }
        },
        "recoveryContract": {
          "type": "object",
          "additionalProperties": false,
          "required": [
            "backupMetadataVersion", "restoreReceiptVersion", "sourceRuntimeMatch",
            "settingsRestore", "automaticSnapshotRestoreUntil"
          ],
          "properties": {
            "backupMetadataVersion": { "const": 1 },
            "restoreReceiptVersion": { "const": 1 },
            "sourceRuntimeMatch": { "const": "exact-product-version-and-build" },
            "settingsRestore": { "const": "database-snapshot-and-source-runtime-configuration" },
            "automaticSnapshotRestoreUntil": { "const": "service-open" }
          }
        }
      }
    },
    "release": {
      "type": "object",
      "additionalProperties": false,
      "required": [
        "releaseUnitId",
        "version",
        "stage",
        "tagPrefix",
        "channel",
        "sourceVersion",
        "sourceCandidate",
        "generateNotes",
        "targets",
        "assets"
      ],
      "properties": {
        "releaseUnitId": { "const": "codex-mcp-bridge" },
        "version": {
          "type": "string",
          "pattern": "^(0|[1-9][0-9]*)\\.(0|[1-9][0-9]*)\\.(0|[1-9][0-9]*)(?:-rc\\.([1-9][0-9]*))?$"
        },
        "stage": { "enum": ["development", "candidate", "stable", "deprecated"] },
        "tagPrefix": { "type": "string", "pattern": "^[A-Za-z0-9._-]{0,16}$" },
        "channel": { "enum": ["none", "stable", "prerelease"] },
        "sourceVersion": {
          "type": ["string", "null"],
          "pattern": "^(0|[1-9][0-9]*)\\.(0|[1-9][0-9]*)\\.(0|[1-9][0-9]*)$"
        },
        "sourceCandidate": {
          "type": ["string", "null"],
          "pattern": "^(0|[1-9][0-9]*)\\.(0|[1-9][0-9]*)\\.(0|[1-9][0-9]*)-rc\\.([1-9][0-9]*)$"
        },
        "generateNotes": { "type": "boolean" },
        "targets": {
          "type": "object",
          "additionalProperties": false,
          "required": ["macos"],
          "properties": {
            "macos": {
              "type": "object",
              "additionalProperties": false,
              "required": ["architectures", "format", "minimumVersion", "signing", "notarization"],
              "properties": {
                "architectures": {
                  "type": "array",
                  "minItems": 2,
                  "maxItems": 2,
                  "uniqueItems": true,
                  "prefixItems": [
                    { "const": "arm64" },
                    { "const": "x64" }
                  ],
                  "items": false
                },
                "format": { "const": "dmg" },
                "minimumVersion": { "const": "13.0" },
                "signing": { "const": "ad-hoc" },
                "notarization": { "const": "none" }
              }
            }
          }
        },
        "assets": {
          "type": "array",
          "minItems": 5,
          "maxItems": 5,
          "uniqueItems": true,
          "items": {
            "enum": [
              "npm-tarball",
              "npm-sha256",
              "macos-arm64-app",
              "macos-x64-app",
              "release-checksums"
            ]
          },
          "allOf": [
            { "contains": { "const": "npm-tarball" } },
            { "contains": { "const": "npm-sha256" } },
            { "contains": { "const": "macos-arm64-app" } },
            { "contains": { "const": "macos-x64-app" } },
            { "contains": { "const": "release-checksums" } }
          ]
        }
      },
      "allOf": [
        {
          "if": { "properties": { "stage": { "const": "candidate" } } },
          "then": {
            "properties": {
              "version": { "type": "string", "pattern": "^(0|[1-9][0-9]*)\\.(0|[1-9][0-9]*)\\.(0|[1-9][0-9]*)-rc\\.([1-9][0-9]*)$" },
              "channel": { "const": "prerelease" },
              "sourceVersion": { "type": "string" },
              "sourceCandidate": { "type": "null" }
            }
          }
        },
        {
          "if": { "properties": { "stage": { "const": "stable" } } },
          "then": {
            "properties": {
              "version": { "type": "string", "pattern": "^(0|[1-9][0-9]*)\\.(0|[1-9][0-9]*)\\.(0|[1-9][0-9]*)$" },
              "channel": { "const": "stable" },
              "sourceVersion": { "type": "string" },
              "sourceCandidate": { "type": "string" }
            }
          }
        },
        {
          "if": { "properties": { "stage": { "enum": ["development", "deprecated"] } } },
          "then": {
            "properties": {
              "version": { "type": "string", "pattern": "^(0|[1-9][0-9]*)\\.(0|[1-9][0-9]*)\\.(0|[1-9][0-9]*)$" },
              "channel": { "const": "none" },
              "sourceVersion": { "type": "null" },
              "sourceCandidate": { "type": "null" }
            }
          }
        }
      ]
    }
  }
}
