{
  "$schema": "./release-manifest.schema.json",
  "manifestVersion": 6,
  "product": {
    "displayName": "Codex MCP Bridge for ChatGPT",
    "description": "A policy-enforcing Streamable HTTP MCP bridge from ChatGPT to local Codex.",
    "runtimeName": "codex-mcp-bridge"
  },
  "package": {
    "name": "codex-mcp-bridge-for-chatgpt",
    "binaryName": "codex-mcp-bridge",
    "license": "MIT",
    "files": [
      "dist",
      "README.md",
      "LICENSE",
      "UPSTREAM.md",
      "docs",
      "scripts/auth-selection.mjs",
      "scripts/auth-selection.d.mts",
      "scripts/build-fingerprint.mjs",
      "scripts/child-shutdown.mjs",
      "scripts/launcher-options.mjs",
      "scripts/managed-file.mjs",
      "scripts/managed-file.d.mts",
      "scripts/runtime-env.mjs",
      "scripts/runtime-lock.mjs",
      "scripts/runtime-status.mjs",
      "scripts/runtime-status.d.mts",
      "scripts/start-codex-mcp-bridge.mjs",
      "scripts/text-integrity.d.mts",
      "scripts/text-integrity.mjs",
      "scripts/tunnel-profile.mjs",
      ".codex-plugin",
      ".app.json",
      "release-manifest.json",
      "release-manifest.schema.json",
      "ui-release-catalog.json",
      "state-migrations.json"
    ],
    "keywords": [
      "codex",
      "chatgpt",
      "mcp",
      "model-context-protocol",
      "bridge"
    ]
  },
  "toolchain": {
    "node": "22",
    "npm": "10.9.3",
    "codexCli": "0.153.3"
  },
  "repository": {
    "provider": "github",
    "owner": "menaje",
    "name": "codex-mcp-bridge-for-chatgpt"
  },
  "plugin": {
    "name": "codex-mcp-bridge",
    "displayName": "Codex MCP Bridge for ChatGPT",
    "shortDescription": "Connect ChatGPT to your local Codex",
    "longDescription": "Run and monitor local Codex tasks from ChatGPT through a policy-enforcing MCP bridge. Connect directly to your selected Codex CLI through App Server, with local access controls, approvals, live progress, cancellation and conversation management.",
    "developerName": "menaje",
    "category": "Developer Tools",
    "capabilities": [
      "Run and continue local Codex tasks",
      "Monitor agents, activities, and jobs",
      "Choose models and reasoning effort",
      "Control working folders and access policy"
    ],
    "defaultPrompt": [
      "Ask local Codex to inspect this project and explain how it works.",
      "Use local Codex to implement this change and track the activity.",
      "Show the status of my active Codex agents and activities."
    ],
    "app": {
      "name": "codex-mcp-bridge",
      "id": "plugin_asdk_app_6a86b6dc2fd4819192d54ec3fb27e5b0"
    }
  },
  "uiResources": {
    "strategy": "versioned-uri",
    "hashAlgorithm": "sha256",
    "minimumContractGeneration": {
      "settings": 9,
      "dashboard": 6
    },
    "resources": [
      "settings",
      "dashboard"
    ],
    "activeResources": [
      "settings",
      "dashboard"
    ],
    "compatibilityResources": [],
    "releaseCatalog": "ui-release-catalog.json",
    "releaseCatalogSha256": "56a20b4eb7c2777c7b2b257042b60707fa58f58e90fcbd0b84ce2f8db4210c3e"
  },
  "stateCompatibility": {
    "currentSchema": 31,
    "supportedSourceSchemas": [
      3,
      4,
      5,
      6,
      7,
      8,
      9,
      10,
      11,
      12,
      13,
      14,
      15,
      16,
      17,
      18,
      19,
      20,
      21,
      22,
      23,
      24,
      25,
      26,
      27,
      28,
      29,
      30
    ],
    "unsupportedSourceSchemas": [
      1,
      2
    ],
    "retiredLegacyImports": [
      "settings-state-json",
      "session-state-json",
      "job-state-json"
    ],
    "migrationCatalog": "state-migrations.json",
    "migrationCatalogSha256": "d6c08acdb6a926aceb489ad67a306984dc8b14bee8b6cfac248056b3ca4f6b06",
    "stateProfilePolicy": "release-stage-isolated-v1",
    "rollbackPolicy": "verified-original-before-service-open-v1",
    "persistentContracts": {
      "userSettingsSchema": 7,
      "taskInputContract": 6,
      "macosHelperProtocol": 2,
      "localCompanionProtocol": 12,
      "remoteCompanionProtocol": 10
    },
    "contractSources": {
      "databaseSchema": "src/stateSchema.ts#CURRENT_STATE_SCHEMA_VERSION",
      "userSettings": "src/modelPolicy.ts#MODEL_POLICY_SCHEMA_VERSION",
      "taskInput": "src/tools.ts#CODEX_TASK_INPUT_CONTRACT_VERSION",
      "macosHelper": "src/macosHelperServer.ts#MACOS_HELPER_PROTOCOL_VERSION",
      "localCompanion": "src/companionServer.ts#COMPANION_PROTOCOL_VERSION",
      "remoteCompanion": "src/remoteCompanionServer.ts#REMOTE_COMPANION_PROTOCOL_VERSION",
      "uiResources": "uiResources.minimumContractGeneration",
      "executionBackend": "toolchain.codexCli+app-server-schema.lock.json"
    },
    "recoveryContract": {
      "backupMetadataVersion": 1,
      "restoreReceiptVersion": 1,
      "sourceRuntimeMatch": "exact-product-version-and-build",
      "settingsRestore": "database-snapshot-and-source-runtime-configuration",
      "automaticSnapshotRestoreUntil": "service-open"
    }
  },
  "release": {
    "releaseUnitId": "codex-mcp-bridge",
    "version": "0.4.1",
    "stage": "development",
    "tagPrefix": "v",
    "channel": "none",
    "sourceVersion": null,
    "sourceCandidate": null,
    "generateNotes": true,
    "targets": {
      "macos": {
        "architectures": [
          "arm64",
          "x64"
        ],
        "format": "dmg",
        "minimumVersion": "13.0",
        "signing": "ad-hoc",
        "notarization": "none"
      }
    },
    "assets": [
      "npm-tarball",
      "npm-sha256",
      "macos-arm64-app",
      "macos-x64-app",
      "release-checksums"
    ]
  }
}
